,,,,,,,,,,,,,,
,,,,,,,,,,,,,,
,カテゴリ,フロア,店名,ふりがな（ひらがな表記）,画像ファイル名,大見出し①,大見出し②,大見出し③,中見出し①,中見出し②,中見出し③,中見出し④,補足①,補足②
1,ファッション,4F,アースミュージック＆エコロジープレミアムストア,あーすみゅーじっくあんどえころじーぷれみあむすとあ,ph001.jpg,"10,000円以上のお買い上げでマフラープレゼント！",,,,,,,先着50名様,
2,ファッション,2F,アーノルド パーマー,あーのるどぱーまー,ph002.jpg,"①10,000円以上のお買い上げの方に、タオルハンカチをプレゼント！",②自社アプリ会員様限定スペシャルプライス,,,,,,①11/1（水）～11/14（火） なくなり次第終了,②11/15（水）～12/31（日）
3,ファッション,B1,アーバンリサーチ ドアーズ,あーばんりさーちどあーず,ph003.jpg,UR CLUBポイントアップキャンペーン！,,,,,,,11/9(木）～11/15（水）,
4,ファッション,2F,アーバンリサーチ ロッソ,あーばんりさーちろっそ,ph004.jpg,UR CLUBポイントアップキャンペーン！,,,,,,,11/9(木）～11/15（水）,
5,ファッション,B1,アズ ノゥ アズ ドゥ バズ,あずのぅあずどぅばず,ph005.jpg,"①10,000円以上のお買い上げで、ガチャポンに参加","②30,000円（税抜）以上のお買上げで、ショップカードWポイント！",,,,,,11/22（水）～11/26（日）,
6,ファッション,4F,アモスタイル バイ トリンプ,あもすたいるばいとりんぷ,ph006.jpg,"①5,500円お買い上げで、自社アプリ500円プレゼント！","②カラーコンサル実施で、当日使える1,000円クーポンプレゼント！",,,,,,②11/25（土）、26（日）限定,
7,ファッション,4F,アルシーヴ,あるしーゔ,ph007.jpg,0000円以上お買い上げの方に、ストールプレゼント！,,,,,,,先着00名様,00/00（ ）～
8,ファッション,3F,アンフィ,あんふぃ,ph008.jpg,"8,000円以上お買い上げの方に、オリジナルランジェリーネットプレゼント！",,,,,,,先着22名様,11/17（金）～
9,ファッション,4F,179ダブルジー ニコルクラブ,いちななきゅうだぶるじーにこるくらぶ,ph009.jpg,"5,000円以上お買い上げの方に、オリジナルトートバッグプレゼント！",,,,,,,先着50名様,11/22（水）～11/26（日）
10,ファッション,4F,イーボル,いーぼる,ph010.jpg,"50周年記念 5,000円均一","秋冬アイテムを5,000円均一で販売します。",,,,,,11/00（ ）～11/00（ ）,
11,ファッション,B1,インデックス,いんでっくす,ph011.jpg,ワールドプレミアムクラブポイント5倍！,,,,,,,11/22（水）～11/26（日）,
12,ファッション,3F,ウィルセレクション＆スウィングル,うぃるせれくしょんあんどすぃんぐる,ph012.jpg,ジョイナス店限定 一部商品をスペシャルプライスで販売します。,,,,,,,11/00（ ）～11/00（ ）,
13,ファッション,3F,ウサギ オンライン ストア,うさぎおんらいんすとあ,ph013.jpg,未定,,,,,,,,
14,ファッション,3F,エヌ ナチュラルビューティーベーシック,えぬなちゅらるびゅーてぃーべーしっく,ph014.jpg,ビスチェドッキングニットワンピースのジョイナス限定カラー販売。,"14,740円",,,,,,10/25（水）販売開始,
15,ファッション,B1,エブリィベリーナイスクラップ,えぶりぃべりーないすくらっぷ,ph015.jpg,ノベルティプレゼント,,,,,,,先着00名様,
16,ファッション,4F,エヘカ ソポ,えへかそぽ,ph016.jpg,"5,500円以上お買い上げの方に、限定ショッパープレゼント！",,,,,,,先着50名様,
17,ファッション,3F,オズモーシス,おずもーしす,ph017.jpg,①限定アイテム 配色リブニットワンピース」,"10,780円",②メンバーズポイント20倍UP,,,,,①11/18（土）販売開始,②11/18（土）～11/26（日）
18,ファッション,4F,オリーブ デ オリーブ,おりーぶでおりーぶ,ph018.jpg,ジョイナス店限定カラーのサイドスリットベルトカーゴパンツの販売,"6,490円",,,,,,,
19,ファッション,2F,かぐれ,かぐれ,ph019.jpg,UR CLUBポイントアップキャンペーン！,,,,,,,11/9(木）～11/15（水）,
20,ファッション,1F,カルバン・クライン,かるばん・くらいん,ph020.jpg,アウターキャンペーン,"38,500円以上のお買い上げの方に、オリジナルサコッシュ＆折りたたみ傘プレゼント！",,,,,,11/3（金）～11/26（日）,なくなり次第終了
21,ファッション,B1,河谷シャツ,かわたにしゃつ,ph021.jpg,期間中、河谷シャツポイント2倍！,,,,,,,11/1（日）～11/30（木）,
22,ファッション,3F,キュー,きゅー,ph022.jpg,"①スターニットの限定カラーを販売します 14,300円",②アプリポイントアップ,,,,,,①12/7（木）販売開始,②11/1（水）～11/30（木）
23,ファッション,B1,銀座花菱,ぎんざはなびし,ph023.jpg,ジョイナス50周年記念スペシャルプライス,"5,500円の数量限定商品を販売します。",,,,,,,
24,ファッション,4F,クリア,くりあ,ph024.jpg,2BUYスペシャルプライス,,,,,,,11/22（水）～11/26（日）,
25,ファッション,1F,グレースコンチネンタル・ザ・バンケット,ぐれーすこんちねんたる・ざ・ばんけっと,ph025.jpg,限定カービングアイテム,,,"mini boston bag：限定色タンブガッティ 52,800円","stand wallet3:限定色タンブガッティー 23,100円",,,11/22（水）販売開始,
26,ファッション,4F,神戸レタス,こうべれたす,ph026.jpg,"6,000円以上お買い上げの方に、ノベルティ（ストール）をプレゼント！",,,,,,,先着60名様,
27,ファッション,B1,ココディール,ここでぃーる,ph027.jpg,"アウターを含む30,000円以上お買い上げの方に、ミニスクエアチェーンバッグをプレゼント！",,,,,,,11/9スタート,※なくなり次第終了
28,ファッション,3F,さが美,さがみ,ph028.jpg,きものデビューセット（洗える着物+半巾帯）をオトクな価格でご提供,"5,000円",,,,,,11/16（木）～11/26（日）,
29,ファッション,B1,サマンサモスモス オロフオネ,さまんさもすもすおろふおね,ph029.jpg,"8,000円以上お買い上げの方に、限定ノベルティ（トートBag）をプレゼント！",,,,,,,先着100名様,
30,ファッション,B1,サルート バイ ワコール,さるーとばいわこーる,ph030.jpg,"店内商品、16,500円以上お買い上げ頂いた方に、ランジェリーウォッシュのボトル1本プレゼント",,,,,,,先着50名様,
31,ファッション,4F,ジーバイゴージ,じーばいごーじ,ph031.jpg,"①お買上げ5,000円（税込）ごとに1,000円チケットプレゼント！",②アウターをジョイナス店限定特別価格で販売,,,,,,①11/1（水）～11/17（金）,②11/18（土）～11/26（日）
32,ファッション,B1,スーパーハッカ,すーぱーはっか,ph032.jpg,コート、ジャケット等 期間中スペシャルプライス,,,,,,,11/17（金）～11/26（日）,
33,ファッション,B1,ストラ,すとら,ph033.jpg,"期間中、対象アウター又は38,500円以上お買上げの方に、オリジナルブランケットプレゼント！",,,,,,,10/27（金）～11/12（日）,なくなり次第終了
34,ファッション,4F,スプレイ リビー＆ローズ,すぷれいりびーあんどろーず,ph034.jpg,"5,500円以上お買い上げの方に、スマホショルダープレゼント！",,,,,,,※なくなり次第終了,
35,ファッション,B1,スリークォーター,すりーくぉーたー,ph035.jpg,自社ポイント2倍,,,,,,,11/1（水）～11/30（木）,
36,ファッション,B1,センスオブプレイス バイ アーバンリサーチ,せんすおぶぷれいすばいあーばんりさーち,ph036.jpg,UR CLUBポイントアップキャンペーン！,,,,,,,11/9(木）～11/15（水）,
37,ファッション,3F,ゾルバ,ぞるば,ph037.jpg,自社オリジナルブランドシール・キーホルダーの無料配布！,,,,,,,先着30名様,
38,ファッション,4F,ダズリン,だずりん,ph038.jpg,"22,000円以上のお買い上げの方に、オリジナルルームウェアをプレゼント！",,,,,,,11/22（水）スタート,
39,ファッション,4F,ダブルクローゼット,だぶるくろーぜっと,ph039.jpg,ジョイナス先行販売,,,,,,,11/22（水）販売開始,
40,ファッション,4F,ダブルネーム,だぶるねーむ,ph040.jpg,"15,000円以上のお買上げの方に、オリジナルスケジュールノートプレゼント！",,,,,,,11/9（木）スタート,なくなり次第終了
41,ファッション,1F,チャリングクロス ハムステッド,ちゃりんぐくろすはむすてっど,ph041.jpg,ジョイナス店限定プライス商品の販売,,,,,,,11/1（水）～11/21（火）,
42,ファッション,B1,ドゥ アルシーヴ,どぅあるしーゔ,ph042.jpg,"20,000円以上のお買い上げで、マフラーをプレゼント！",,,,,,,先着20名様,12/22（金）スタート
43,ファッション,B1,トッコクローゼット,とっこくろーぜっと,ph043.jpg,tocco closetポイントカードWポイント,,,,,,,11/22（水）～26（日）,
44,ファッション,B1,トランテアン ソン ドゥ モード,とらんてあんそんどぅもーど,ph044.jpg,"25,000円以上お買い上げの方に、オリジナルルームウェア（ジップパーカー）をプレゼント！",,,,,,,11/9（水）スタート,※なくなり次第終了
45,ファッション,B1,ナチュラルビューティーベーシック,なちゅらるびゅーてぃーべーしっく,ph045.jpg,メンバーズポイントアップ,,,,,,,11/22（水）～26（日）,
46,ファッション,1F,ノーブル,のーぶる,ph046.jpg,ダウンブランド「DUNO」のPOP UPを開催！,,,,,,,11/15（水）～11/30（木）,
47,ファッション,B1,ノーリーズ,のーりーず,ph047.jpg,ジョイナス店限定カラー（ベビーピンク）,衿端パール片畦ハイネックプルオーバーニット,"18,700円",,,,,,
48,ファッション,B1,パラスパレス,ぱらすぱれす,ph048.jpg,"期間中33,000円以上お買い上げの方に、オリジナルバンダナをプレゼント！",,,,,,,先着20名様,11/22（水）～11/26（日）
49,ファッション,1F,ピーエス ポール・スミス,ぴーえすぽーるすみす,ph049.jpg,ジョイナス先行販売,,,"セットアップで55,000円","ジャケット38,500円","パンツ16,500円",,10/28（土）販売開始,
50,ファッション,2F,ビーセカンド,びーせかんど,ph050.jpg,洗練された都市と自由な自然のスタイルと合わせ、地球環境・生産背景にこだわる木の実由来のサスティナブルブランドの「KAPOK KNOT」のPOP UPを開催します。,,,,,,,11/3（金）～12/25（月）,
51,ファッション,B1,ヒコウセンカーラ,ひこうせんかーら,ph051.jpg,"5,500円以上お買い上げの方に、アニバーサリー巾着プレゼント！",,,,,,,先着50名様,
52,ファッション,1F,ヒステリックグラマー,ひすてりっくぐらまー,ph052.jpg,50周年を記念しての別注パーカー,"29,700円",,,,,,11/22（水）販売開始,
53,ファッション,4F,フィント,ふぃんと,ph053.jpg,winter collection event,Fi.n.t · an another angelus「オリジナルトートバッグ」プレゼント！,Fi.n.t横浜ジョイナス店限定！オリジナルカラーのワンピ―スを販売します。,,,,,詳しい内容はこちらをご覧ください,＠fint_yokohama
54,ファッション,4F,プー ドゥ ドゥ,ぷーどぅどぅ,ph054.jpg,"10,000円以上お買い上げの方に、エコバッグプレゼント！",,,,,,,※なくなり次第終了,
55,ファッション,4F,フォーエバー 21,ふぉーえばーとぅえんてぃーわん,ph055.jpg,"アプリ会員6,000円以上お買い上げで、オリジナル折りたたみ傘プレゼント！（当日入会可）",,,,,,,※なくなり次第終了,
56,ファッション,3F,ブラデリスニューヨーク,ぶらでりすにゅーよーく,ph056.jpg,横浜ジョイナス特別企画,"ナイトケアセット／お得な2枚セット 5,940円","ヒップケアセット／お得な3枚セット 3,300円",,,,,,
57,ファッション,3F,プロポーション アリュール,ぷろぽーしょんありゅーる,ph057.jpg,ジョイナス店限定カラー,フェザーマーメイドニットワンピース,"12,980円",,,,,10/30（月）販売開始,
58,ファッション,4F,ページボーイ,ぺーじぼーい,ph058.jpg,0000円以上お買い上げの方に、ノベルティ（〇〇〇〇）をプレゼント！,,,,,,,先着00名様（又はなくなり次第終了）,00/00（ ）～
59,ファッション,4F,ポートランド,ぽーとらんど,ph059.jpg,"5,500円以上お買い上げごとに、通常の自社ポイントにプラス500ポイントをプレゼント！",,,,,,,11/1（水）～11/21（火）,
60,ファッション,4F,マジェスティックレゴン,まじぇすてぃっくれごん,ph060.jpg,ジョイナス限定カラーアイテム,キラキラビジューチェーンニット 限定カラーピンク,"5,940円",,,,,11/3（金）販売開始,
61,ファッション,B1,マルチュウ,まるちゅう,ph061.jpg,"スペシャルプライス 各種1,100円均一",,,,,,,11/1（水）～12/31（日）,
62,ファッション,4F,ミスティウーマン,みすてぃうーまん,ph062.jpg,"18,000円以上のお買い上げで、ミニショルダーBagをプレゼント！",,,,,,,先着30名様,11/00（ ）～
63,ファッション,B1,ラディエイト,らでぃえいと,ph063.jpg,一部商品スペシャルプライス,,,,,,,11/1（水）～11/13（月）,
64,ファッション,B1,ランドリー,らんどりー,ph064.jpg,横浜限定商品,セーラーBOYコインポーチ,"2,750円",,,,,,
65,ファッション,B1,リリアン カラット,りりあんからっと,ph065.jpg,"16,500円以上お買上げの方に、ボールチェーンデザインミニバッグをプレゼント！",,,,,,,11/9（木）スタート,※なくなり次第終了
66,ファッション,B1,ル・クール ブラン,るくーるぶらん,ph066.jpg,ジョイナス50周年限定,スエードトートバッグ,"10,780円",,,,,10/16（月）販売開始,
67,ファッション,4F,レイカズン,れいかずん,ph067.jpg,0000円以上お買い上げの方に、ノベルティ（〇〇〇〇）をプレゼント！,,,,,,,先着50名様,
68,ファッション,4F,レトロガール,れとろがーる,ph068.jpg,レトロガールのメンバーズポイントを20％還元！,,,,,,,11/15（水）～26（日）,
69,ファッション,B1,ロイス クレヨン,ろいすくれよん,ph069.jpg,"30,000円以上お買上げの方に、ノベルティをプレゼント！",,,,,,,11/22（水）～11/26（日）,
70,ファッション,B1,ロペピクニック,ろぺぴくにっく,ph070.jpg,スペシャルイベント,,,,,,,,
71,ファッション,4F,ワンアフターアナザーナイスクラップ,わんあふたーあなざーないすくらっぷ,ph071.jpg,"12,000円お買上げの方に、ノベルティプレゼント！",,,,,,,11/9（木）or10（金）スタート,※なくなり次第終了
72,ファッショングッズ,3F,ア ドゥ ヴィーヴル,あどぅゔぃーゔる,ph072.jpg,お買上げの方、全員対象でオリジナルノベルティ［靴べら］プレゼント！,,,,,,,※なくなり次第終了,
73,ファッショングッズ,１F,アトモス,あともす,ph073.jpg,TOKYO23というオリジナルブランドのPOP UPを開催。,,,,,,,,
74,ファッショングッズ,B1,アヤノコウジ,あやのこうじ,ph074.jpg,横浜店限定カラー「マリンブルー」。初登場アイテム。,ジャンボがま口バッグ,"36,520円",,,,,,
75,ファッショングッズ,3F,イース,いーす,ph075.jpg,"1,000円以上お買い上げの方に、ヘアアクセサリーをプレゼント！",,,,,,,先着50名様,
76,ファッショングッズ,１F,イア パピヨネ,いあぱぴよね,ph076.jpg,"18,000円以上お買い上の方に、ノベルティ（ポーチ）プレゼント！",,,,,,,先着60名様,
77,ファッショングッズ,B1,イワキメガネ,いわきめがね,ph077.jpg,メガネフレーム+レンズ一式作製のお客様へ,フランスのメガネブランド「ラフォン」のセリート（メガネ拭き）をプレゼント！,,,,,,先着30名様,
78,ファッショングッズ,3F,エイチエムエス ウォッチストア,えいちえむえすうぉっちすとあ,ph078.jpg,"15,000円以上お買い上げの方に、ノベルティ（HAAN、ハンドスプレー）をプレゼント！",,,,,,,先着50名様,
79,ファッショングッズ,B1,エース バッグス＆ラゲージ,えーすばっぐすあんどらげーじ,ph079.jpg,"①特価スーツケース20本 15,000円（税込）均一",②ACE MEMBERS PROGRAM 2倍ポイントアップ,,,,,,①11/13（月）販売開始,②11/13（月）～11/26（日）
80,ファッショングッズ,3F,エフィーズ クローゼット,えふぃーずくろーぜっと,ph080.jpg,00000円以上お買い上げの方に、ノベルティをプレゼント！,,,,,,,先着00名様（又はなくなり次第終了）,00/00（ ）～
81,ファッショングッズ,1F,エンチャンテッド,えんちゃってっど,ph081.jpg,"お買上げの方に次回から使える1,000円OFFチケットプレゼント！",,,,,,,00/00（ ）～00/00（ ）,
82,ファッショングッズ,B1,オグラ眼鏡店,おぐらめがねてん,ph082.jpg,眼鏡一式ご購入の方へ、超極細繊維素材の「オグラ眼鏡店オリジナル メガネ拭き」をプレゼントいたします。,,,,,,,先着30名様,
83,ファッショングッズ,4F,オリエンタルトラフィック,おりえんたるとらふぃっく,ph083.jpg,シューズお買い上げでノベルティプレゼント！,,,,,,,先着50名様,
84,ファッショングッズ,B1,ガーランド オブ デュウ,がーらんどおぶでゅう,ph084.jpg,"3,300円以上お買い上げの方にノベルティ（オリジナルヘアゴム）プレゼント！",,,,,,,先着40名様,
85,ファッショングッズ,2F,貴和製作所,きわせいさくじょ,ph085.jpg,見るワークショップを開催！［観覧無料］,KIWA PLUSキットを使って丸カン開閉、ピン曲げ、石座の留め方が学べます。,,,,,,11/11(土）、11/18（土）13:30～、15:00～,※詳細は店舗スタッフまでお尋ねください。
86,ファッショングッズ,B1,靴下屋,くつしたや,ph086.jpg,ジョイナス店限定のお得なハッピーバッグを限定50個で販売！！,,,,,,,限定50個,11/1（日）～11/30（木）
87,ファッショングッズ,2F,ソット,そっと,ph087.jpg,sot横浜ジョイナス店限定カラー財布,,,"オースピスレザー長財布 20,900円","オースピスレザーミニ財布 17,600円","オースピスレザーLファスナーキーケース 11,000円",,,
88,ファッショングッズ,4F,チュチュアンナ,ちゅちゅあんな,ph088.jpg,自社アプリポイント5倍,,,,,,,11/22（水）～11/26（日）,
89,ファッショングッズ,1F,トプカピ,とぷかぴ,ph089.jpg,"20,000円以上のお買い上げで、フェルトミニトートプレゼント！",,,,,,,先着100名様,
90,ファッショングッズ,4F,パーツクラブ,ぱーつくらぶ,ph090.jpg,パーツクラブ横浜店アニバーサリーイベント,レジン液星の雫スペシャルプライス！,"1,056円",,,,,各日限定20個,11/3（金）～11/5（日）
91,ファッショングッズ,B1,フィットフィット,ふぃっとふぃっと,ph091.jpg,スニーカー 一部スペシャルプライスで販売します。,,"10,890円～",,,,,,
92,ファッショングッズ,4F,ブルーム,ぶるーむ,ph092.jpg,①JOINUS 50周年記念BLOOMアプリスタンプ2倍,②ハッピーバッグ,,"K10ピアス2点セット 3,300円","K10イヤリング＆イヤカフセット 8,800円","K10ブレスレット、ネックレス2点セット 13,200円",,①11/1（水）～12/25（月）,②11/1（水）販売開始 なくなり次第終了
93,ファッショングッズ,B1,ベリテ,べりて,ph093.jpg,ベリテ横浜店限定価格商品,,,"プラチナダイヤモンドピアス 5,000円","プラチナダイヤモンドネックレス 50,000円","プラチナダイヤモンドリング 500,000円","プラチナピングゴールドリング 500,000円",,
94,ファッショングッズ,B1,ミナカイ,みなかい,ph094.jpg,JOINUS50周年記念,スペシャルプライス,"5,500円",,,,,11/20（月）～11/26（日）,
95,ファッショングッズ,B1,メゾン ド フルール,めぞんどふるーる,ph095.jpg,横浜ジョイナス限定,限定スクエアトートバッグ BLACK、PINK2色展開,"6,900円",,,,,11/22（水）販売開始,
96,ファッショングッズ,4F,メディストア,めでぃすとあ,ph096.jpg,"5,000円以上のお買上げの方に、1,000円OFFクーポンプレゼント",,,,,,,11/22（水）～11/30（木）,
97,ファッショングッズ,B1,モレスキン,もれすきん,ph097.jpg,"①3,000円（税込）以上お買い上げで参加できるハズレなし抽選会！
 1等は1万円相当のモレスキン商品、2等以下は割引チケット、ノベルティ他が当たります。",②通常550円（税込）の名入れを無料サービスします。,,,,,,①11/17（金）～11/30（木）,②11/1（水）～11/30（木）
98,ファッショングッズ,B1,ランダ,らんだ,ph098.jpg,"10,000円以上のお買い上げで、ノベルティ［ミニバッグ］プレゼント！",,,,,,,先着45名様,
99,ファッショングッズ,1F,ルートート ギャラリー,るーとーとぎゃらりー,ph099.jpg,そうにゃんコラボトートバッグ,,,,,,,,
100,ファッショングッズ,B1,レン,れん,ph100.jpg,happy bag seｔ,,"19,800円",,,,,限定5点,
101,ライフスタイル＆コスメ,3F,アインズ＆トルペ,あいんずあんどとるぺ,ph101.jpg,AYURAボディケアセット,,"4,180円",アユーラメディテーションバス（300ml）とアロマティックウォッシュα（300ml）に蓬香草湯2包が付いてくる,,,,限定30セット,10/25（水）～
102,ライフスタイル＆コスメ,B1,アフタヌーンティー・リビング,あふたぬーんてぃーりびんぐ,ph102.jpg,お楽しみバッグ,,"3,850円",,,,,なくなり次第終了,
103,ライフスタイル＆コスメ,3F,イッツデモ,いっつでも,ph103.jpg,お洋服をスペシャルプライスで販売,,,,,,,11/1（水）～12/31（日）,
104,ライフスタイル＆コスメ,1F,イニスフリー,いにすふりー,ph104.jpg,ラッキーバッグ,,,,,,,,
105,ライフスタイル＆コスメ,２F,エシカルシー,えしかるしー,ph105.jpg,ハッピーバッグ,,,"ボディケア・スキンケアセット 7,000円","フードセット  5,000円",,,,
106,ライフスタイル＆コスメ,B1,吉祥寺菊屋,きちじょうじきくや,ph106.jpg,"1,000円以上のお買い上げの方に、スポンジ1つプレゼント！",,,,,,,先着250名様,
107,ライフスタイル＆コスメ,1F,キッチンキッチン,きっちんきっちん,ph107.jpg,"1,650円以上お買い上げの方に、ノベルティプレゼント！",,,,,,,先着150名様,11/22（水）スタート
108,ライフスタイル＆コスメ,B1,キャトル・セゾン,きゃとるせぞん,ph108.jpg,ダブルスタンプキャンペーン！自社ポイントカード2倍スタンプ,,,,,,,11/15（水）～11/21（火）,
109,ライフスタイル＆コスメ,3F,ケユカ,けゆか,ph109.jpg,期間中、雑貨・アパレル全品ご購入でケユカポイント5倍で付与,,,,,,,11/1（水）～11/14（火）,
110,ライフスタイル＆コスメ,B1,ザ・コスメティックテラスタシロ,ざこすめてぃっくてらすたしろ,ph110.jpg,未定,,,,,,,,
111,ライフスタイル＆コスメ,B1,ザボディショップ,ざぼでぃしょっぷ,ph111.jpg,"6,600円以上お買い上げの方に、香りが選べるハンドクリームをプレゼント！",,,,,,,11/22（水）スタート,数量限定 なくなり次第終了
112,ライフスタイル＆コスメ,3F,サンリオ ビビティックス,さんりおびびてぃっくす,ph112.jpg,"2,200円以上お買い上げで、オリジナルノベルティ缶バッヂを1点プレゼント！",,,,,,,500個限定,
113,ライフスタイル＆コスメ,B1,トゥールズ,とぅーるず,ph113.jpg,コピックチャオ・そうにゃんぬり絵セット,,"1,386円","そうにゃんと相鉄車輌がぬれるコックピットチャオ4色セット。
 そうにゃんぬり絵2枚付、専用ケース付",,,,数量限定,
114,ライフスタイル＆コスメ,B1,ナチュラルキッチン アンド,なちゅらるあきっちんあんど,ph114.jpg,"2,200円以上お買い上げの方にノベルティプレゼント",,,,,,,先着200名様,11/22（水）スタート
